{
  "artifact_type": "proof_artifact_v1",
  "schema_version": "1.0.0",
  "protocol_version": "1.0",
  "agreement_id": "agr-phase3-001",
  "revision_id": "rev-phase3-001",
  "proof_id": "proof-phase3-001",
  "statement_hash": "sha256:statement",
  "proof_payload_hash": "sha256:payload",
  "verifier_ref": "verifier-phase3-001",
  "created_at": "2026-03-19T05:00:00Z"
}
